[
  {
    "id": "mashhad:station:vakilabad",
    "cityId": "mashhad",
    "names": {
      "fa": "وکیل آباد",
      "en": "VakilAbad"
    },
    "location": {
      "lat": 36.345084785978656,
      "lng": 59.44224260525624
    },
    "amenities": {
      "wc": null,
      "elevator": null,
      "atm": null,
      "coffeeShop": null,
      "fastFood": null,
      "groceryStore": null,
      "freeWifi": null,
      "prayerRoom": null,
      "parking": null,
      "police": null
    },
    "amenitiesVerified": false,
    "status": "operational",
    "sourceKeys": {
      "upstreamKey": "VakilAbad"
    }
  },
  {
    "id": "mashhad:station:koohestan-park",
    "cityId": "mashhad",
    "names": {
      "fa": "کوهستان پارک",
      "en": "Koohestan Park"
    },
    "location": {
      "lat": 36.34296998192113,
      "lng": 59.451731881605184
    },
    "amenities": {
      "wc": null,
      "elevator": null,
      "atm": null,
      "coffeeShop": null,
      "fastFood": null,
      "groceryStore": null,
      "freeWifi": null,
      "prayerRoom": null,
      "parking": null,
      "police": null
    },
    "amenitiesVerified": false,
    "status": "operational",
    "sourceKeys": {
      "upstreamKey": "Koohestan Park"
    }
  },
  {
    "id": "mashhad:station:namayeshgah",
    "cityId": "mashhad",
    "names": {
      "fa": "نمایشگاه",
      "en": "Namayeshgah"
    },
    "location": {
      "lat": 36.339582052149495,
      "lng": 59.46251981981925
    },
    "amenities": {
      "wc": null,
      "elevator": null,
      "atm": null,
      "coffeeShop": null,
      "fastFood": null,
      "groceryStore": null,
      "freeWifi": null,
      "prayerRoom": null,
      "parking": null,
      "police": null
    },
    "amenitiesVerified": false,
    "status": "operational",
    "sourceKeys": {
      "upstreamKey": "Namayeshgah"
    }
  },
  {
    "id": "mashhad:station:eghbal-e-lahouri",
    "cityId": "mashhad",
    "names": {
      "fa": "اقبال لاهوری",
      "en": "Eghbal-e-Lahouri"
    },
    "location": {
      "lat": 36.33600433122949,
      "lng": 59.47399721884244
    },
    "amenities": {
      "wc": null,
      "elevator": null,
      "atm": null,
      "coffeeShop": null,
      "fastFood": null,
      "groceryStore": null,
      "freeWifi": null,
      "prayerRoom": null,
      "parking": null,
      "police": null
    },
    "amenitiesVerified": false,
    "status": "operational",
    "sourceKeys": {
      "upstreamKey": "Eghbal-e-Lahouri"
    }
  },
  {
    "id": "mashhad:station:sayyad-e-shirazi",
    "cityId": "mashhad",
    "names": {
      "fa": "شهید صیاد شیرازی",
      "en": "Sayyad-e-Shirazi"
    },
    "location": {
      "lat": 36.33258465266732,
      "lng": 59.48476588154176
    },
    "amenities": {
      "wc": null,
      "elevator": null,
      "atm": null,
      "coffeeShop": null,
      "fastFood": null,
      "groceryStore": null,
      "freeWifi": null,
      "prayerRoom": null,
      "parking": null,
      "police": null
    },
    "amenitiesVerified": false,
    "status": "operational",
    "sourceKeys": {
      "upstreamKey": "Sayyad-e-Shirazi"
    }
  },
  {
    "id": "mashhad:station:sadaf",
    "cityId": "mashhad",
    "names": {
      "fa": "صدف",
      "en": "Sadaf"
    },
    "location": {
      "lat": 36.330165732115546,
      "lng": 59.4925961144572
    },
    "amenities": {
      "wc": null,
      "elevator": null,
      "atm": null,
      "coffeeShop": null,
      "fastFood": null,
      "groceryStore": null,
      "freeWifi": null,
      "prayerRoom": null,
      "parking": null,
      "police": null
    },
    "amenitiesVerified": false,
    "status": "operational",
    "sourceKeys": {
      "upstreamKey": "Sadaf"
    }
  },
  {
    "id": "mashhad:station:haft-e-tir",
    "cityId": "mashhad",
    "names": {
      "fa": "هفت تیر",
      "en": "Haft-e-Tir"
    },
    "location": {
      "lat": 36.32763063701434,
      "lng": 59.500725009764125
    },
    "amenities": {
      "wc": null,
      "elevator": null,
      "atm": null,
      "coffeeShop": null,
      "fastFood": null,
      "groceryStore": null,
      "freeWifi": null,
      "prayerRoom": null,
      "parking": null,
      "police": null
    },
    "amenitiesVerified": false,
    "status": "operational",
    "sourceKeys": {
      "upstreamKey": "Haft-e-Tir"
    }
  },
  {
    "id": "mashhad:station:danesh-amooz",
    "cityId": "mashhad",
    "names": {
      "fa": "دانش آموز",
      "en": "Danesh Amooz"
    },
    "location": {
      "lat": 36.32515113600685,
      "lng": 59.508521251768855
    },
    "amenities": {
      "wc": null,
      "elevator": null,
      "atm": null,
      "coffeeShop": null,
      "fastFood": null,
      "groceryStore": null,
      "freeWifi": null,
      "prayerRoom": null,
      "parking": null,
      "police": null
    },
    "amenitiesVerified": false,
    "status": "operational",
    "sourceKeys": {
      "upstreamKey": "Danesh Amooz"
    }
  },
  {
    "id": "mashhad:station:seyyed-razi",
    "cityId": "mashhad",
    "names": {
      "fa": "سیدرضی",
      "en": "Seyyed Razi"
    },
    "location": {
      "lat": 36.32272830373989,
      "lng": 59.51641161878166
    },
    "amenities": {
      "wc": null,
      "elevator": null,
      "atm": null,
      "coffeeShop": null,
      "fastFood": null,
      "groceryStore": null,
      "freeWifi": null,
      "prayerRoom": null,
      "parking": null,
      "police": null
    },
    "amenitiesVerified": false,
    "status": "operational",
    "sourceKeys": {
      "upstreamKey": "Seyyed Razi"
    }
  },
  {
    "id": "mashhad:station:kowsar",
    "cityId": "mashhad",
    "names": {
      "fa": "کوثر",
      "en": "Kowsar"
    },
    "location": {
      "lat": 36.3200544142351,
      "lng": 59.525309697727494
    },
    "amenities": {
      "wc": null,
      "elevator": null,
      "atm": null,
      "coffeeShop": null,
      "fastFood": null,
      "groceryStore": null,
      "freeWifi": null,
      "prayerRoom": null,
      "parking": null,
      "police": null
    },
    "amenitiesVerified": false,
    "status": "operational",
    "sourceKeys": {
      "upstreamKey": "Kowsar"
    }
  },
  {
    "id": "mashhad:station:park-e-mellat",
    "cityId": "mashhad",
    "names": {
      "fa": "پارک ملت",
      "en": "Park-e-Mellat"
    },
    "location": {
      "lat": 36.31726615488931,
      "lng": 59.53403020026661
    },
    "amenities": {
      "wc": null,
      "elevator": null,
      "atm": null,
      "coffeeShop": null,
      "fastFood": null,
      "groceryStore": null,
      "freeWifi": null,
      "prayerRoom": null,
      "parking": null,
      "police": null
    },
    "amenitiesVerified": false,
    "status": "operational",
    "sourceKeys": {
      "upstreamKey": "Park-e-Mellat"
    }
  },
  {
    "id": "mashhad:station:azadi",
    "cityId": "mashhad",
    "names": {
      "fa": "آزادی",
      "en": "Azadi"
    },
    "location": {
      "lat": 36.31289694782615,
      "lng": 59.54404701765853
    },
    "amenities": {
      "wc": null,
      "elevator": null,
      "atm": null,
      "coffeeShop": null,
      "fastFood": null,
      "groceryStore": null,
      "freeWifi": null,
      "prayerRoom": null,
      "parking": null,
      "police": null
    },
    "amenitiesVerified": false,
    "status": "operational",
    "sourceKeys": {
      "upstreamKey": "Azadi"
    }
  },
  {
    "id": "mashhad:station:khayyam",
    "cityId": "mashhad",
    "names": {
      "fa": "خیام",
      "en": "Khayyam"
    },
    "location": {
      "lat": 36.30715961638708,
      "lng": 59.55265836527661
    },
    "amenities": {
      "wc": null,
      "elevator": null,
      "atm": null,
      "coffeeShop": null,
      "fastFood": null,
      "groceryStore": null,
      "freeWifi": null,
      "prayerRoom": null,
      "parking": null,
      "police": null
    },
    "amenitiesVerified": false,
    "status": "operational",
    "sourceKeys": {
      "upstreamKey": "Khayyam"
    }
  },
  {
    "id": "mashhad:station:palestine",
    "cityId": "mashhad",
    "names": {
      "fa": "فلسطین",
      "en": "Palestine"
    },
    "location": {
      "lat": 36.300101542022745,
      "lng": 59.5636389472497
    },
    "amenities": {
      "wc": null,
      "elevator": null,
      "atm": null,
      "coffeeShop": null,
      "fastFood": null,
      "groceryStore": null,
      "freeWifi": null,
      "prayerRoom": null,
      "parking": null,
      "police": null
    },
    "amenitiesVerified": false,
    "status": "operational",
    "sourceKeys": {
      "upstreamKey": "Palestine"
    }
  },
  {
    "id": "mashhad:station:taleghani",
    "cityId": "mashhad",
    "names": {
      "fa": "طالقانی",
      "en": "Taleghani"
    },
    "location": {
      "lat": 36.29724700829637,
      "lng": 59.572883505668415
    },
    "amenities": {
      "wc": null,
      "elevator": null,
      "atm": null,
      "coffeeShop": null,
      "fastFood": null,
      "groceryStore": null,
      "freeWifi": null,
      "prayerRoom": null,
      "parking": null,
      "police": null
    },
    "amenitiesVerified": false,
    "status": "operational",
    "sourceKeys": {
      "upstreamKey": "Taleghani"
    }
  },
  {
    "id": "mashhad:station:ghaem",
    "cityId": "mashhad",
    "names": {
      "fa": "قائم(عج)",
      "en": "Ghaem"
    },
    "location": {
      "lat": 36.294414019575456,
      "lng": 59.57844043237702
    },
    "amenities": {
      "wc": null,
      "elevator": null,
      "atm": null,
      "coffeeShop": null,
      "fastFood": null,
      "groceryStore": null,
      "freeWifi": null,
      "prayerRoom": null,
      "parking": null,
      "police": null
    },
    "amenitiesVerified": false,
    "status": "operational",
    "sourceKeys": {
      "upstreamKey": "Ghaem"
    }
  },
  {
    "id": "mashhad:station:shariati",
    "cityId": "mashhad",
    "names": {
      "fa": "شریعتی",
      "en": "Shariati"
    },
    "location": {
      "lat": 36.291132577808526,